{
  "id": "seed-html-017",
  "targetLanguage": "HTML",
  "instruction": "Write an HTML5 head with author, robots, and theme-color meta tags for a public documentation page.",
  "code": "<!DOCTYPE html>\n<html lang=\"en\">\n  <head>\n    <meta charset=\"utf-8\" />\n    <meta name=\"author\" content=\"Example Corp Documentation Team\" />\n    <meta name=\"robots\" content=\"index, follow\" />\n    <meta name=\"theme-color\" content=\"#1a3a5c\" />\n    <title>API reference — Authentication</title>\n  </head>\n  <body>\n    <main>\n      <h1>Authentication</h1>\n    </main>\n  </body>\n</html>",
  "tags": [
    "metadata",
    "L2-standard"
  ],
  "metadata": {
    "author": "pipeline-operator",
    "created": "2026-06-20",
    "source": "manual",
    "notes": "topic: HTML-017"
  }
}
